{
  "$schema": "./workflow-schema.json",
  "version": "1.0.0",
  "description": "Semantic workflow configuration for Obsidian MCP",
  
  "operations": {
    "vault": {
      "description": "File and folder operations in the vault",
      "actions": {
        "list": {
          "description": "List files in a directory",
          "success_hints": {
            "message": "Listed {count} files in {path}",
            "suggested_next": [
              {
                "condition": "has_markdown_files",
                "suggestions": [
                  {
                    "description": "Read a specific file",
                    "command": "vault(action='read', path='<filename>')",
                    "reason": "View file contents",
                    "requires_tokens": "can_navigate_directory"
                  },
                  {
                    "description": "Search within this directory",
                    "command": "vault(action='search', query='<term>', path='{path}')",
                    "reason": "Find specific content"
                  }
                ]
              }
            ]
          }
        },
        
        "read": {
          "description": "Read file contents",
          "success_hints": {
            "message": "Read file: {path}",
            "suggested_next": [
              {
                "condition": "has_links",
                "suggestions": [
                  {
                    "description": "Follow linked notes",
                    "command": "vault(action='read', path='{linked_file}')",
                    "reason": "Explore connected knowledge",
                    "requires_tokens": "can_follow_links"
                  }
                ]
              },
              {
                "condition": "has_tags",
                "suggestions": [
                  {
                    "description": "Find notes with similar tags",
                    "command": "vault(action='search', query='{tags}')",
                    "reason": "Discover related content"
                  }
                ]
              },
              {
                "condition": "always",
                "suggestions": [
                  {
                    "description": "Edit this file",
                    "command": "edit(action='window', path='{path}', ...)",
                    "reason": "Make changes to content"
                  },
                  {
                    "description": "Open in Obsidian",
                    "command": "view(action='open_in_obsidian', path='{path}')",
                    "reason": "Use Obsidian's full features"
                  }
                ]
              }
            ]
          },
          "failure_hints": {
            "message": "File not found: {path}",
            "suggested_next": [
              {
                "condition": "always",
                "suggestions": [
                  {
                    "description": "Create this file",
                    "command": "vault(action='create', path='{path}', content='')",
                    "reason": "Start new document"
                  },
                  {
                    "description": "Search for similar files",
                    "command": "vault(action='search', query='{filename}')",
                    "reason": "Find related content"
                  },
                  {
                    "description": "List directory contents",
                    "command": "vault(action='list', directory='{directory}')",
                    "reason": "Browse available files"
                  }
                ]
              }
            ]
          }
        },
        
        "create": {
          "description": "Create a new file",
          "success_hints": {
            "message": "Created file: {path}",
            "suggested_next": [
              {
                "condition": "always",
                "suggestions": [
                  {
                    "description": "Add content to the file",
                    "command": "edit(action='append', path='{path}', content='...')",
                    "reason": "Start writing"
                  },
                  {
                    "description": "Open in Obsidian for editing",
                    "command": "view(action='open_in_obsidian', path='{path}')",
                    "reason": "Use visual editor"
                  },
                  {
                    "description": "Link from another note",
                    "command": "edit(action='window', path='<other_note>', newText='[[{filename}]]')",
                    "reason": "Connect knowledge"
                  }
                ]
              }
            ]
          }
        },
        
        "search": {
          "description": "Search vault contents",
          "success_hints": {
            "message": "Found {count} matches for '{query}'",
            "suggested_next": [
              {
                "condition": "has_results",
                "suggestions": [
                  {
                    "description": "Read a specific result",
                    "command": "vault(action='read', path='{result_path}')",
                    "reason": "Examine full content"
                  },
                  {
                    "description": "Refine search",
                    "command": "vault(action='search', query='{query} AND <additional_term>')",
                    "reason": "Narrow results"
                  },
                  {
                    "description": "Create synthesis note",
                    "command": "vault(action='create', path='synthesis/{query}-summary.md')",
                    "reason": "Consolidate findings"
                  }
                ]
              },
              {
                "condition": "no_results",
                "suggestions": [
                  {
                    "description": "Try broader search",
                    "command": "vault(action='search', query='{simplified_query}')",
                    "reason": "Expand search scope"
                  },
                  {
                    "description": "Create note on this topic",
                    "command": "vault(action='create', path='{suggested_path}')",
                    "reason": "Start new knowledge"
                  }
                ]
              }
            ]
          }
        }
      }
    },
    
    "edit": {
      "description": "Smart editing operations",
      "actions": {
        "window": {
          "description": "Edit with fuzzy matching - make small, incremental changes",
          "success_hints": {
            "message": "Replaced text at line {line}",
            "suggested_next": [
              {
                "condition": "always",
                "suggestions": [
                  {
                    "description": "Save and verify your changes",
                    "command": "view(action='window', path='{path}', line={line})",
                    "reason": "IMPORTANT: Always verify edits before making more changes"
                  },
                  {
                    "description": "Make another small edit",
                    "command": "edit(action='window', path='{path}', ...)",
                    "reason": "Keep edits small and incremental - avoid large replacements"
                  },
                  {
                    "description": "Open in Obsidian to see full context",
                    "command": "view(action='open_in_obsidian', path='{path}')",
                    "reason": "Review changes in the full editor"
                  }
                ]
              }
            ]
          },
          "failure_hints": {
            "message": "No match found - content buffered",
            "suggested_next": [
              {
                "condition": "always",
                "suggestions": [
                  {
                    "description": "View file to locate text",
                    "command": "view(action='window', path='{path}', searchText='{search_text}')",
                    "reason": "Find correct location"
                  },
                  {
                    "description": "Use buffered content at line",
                    "command": "edit(action='at_line', path='{path}', line=<NUMBER>)",
                    "reason": "Content already saved",
                    "requires_tokens": "can_use_buffer"
                  },
                  {
                    "description": "Retry with buffered content",
                    "command": "edit(action='from_buffer', path='{path}')",
                    "reason": "Use saved content",
                    "requires_tokens": "can_use_buffer"
                  },
                  {
                    "description": "Try with lower threshold",
                    "command": "edit(action='window', path='{path}', oldText='{old_text}', fuzzyThreshold=0.5)",
                    "reason": "Find approximate matches"
                  }
                ]
              }
            ]
          }
        },
        
        "append": {
          "description": "Add content to end of file",
          "success_hints": {
            "message": "Appended content to {path}",
            "suggested_next": [
              {
                "condition": "is_daily_note",
                "suggestions": [
                  {
                    "description": "Add timestamp",
                    "command": "edit(action='append', path='{path}', content='\\n## {time}\\n')",
                    "reason": "Track time entries"
                  }
                ]
              },
              {
                "condition": "always",
                "suggestions": [
                  {
                    "description": "View the updated file",
                    "command": "view(action='file', path='{path}')",
                    "reason": "See full content"